{
  "$schema": "https://json-schema.org/draft/2020-12/schema",
  "$id": "https://volatoo.org/schemas/portage-state-v1.schema.json",
  "title": "Volatoo Portage desired state v1",
  "type": "object",
  "additionalProperties": false,
  "required": [
    "schema",
    "target_id",
    "config_digest",
    "world_digest",
    "repositories",
    "profile",
    "toolchain"
  ],
  "properties": {
    "schema": {
      "const": "org.volatoo.portage-state/v1"
    },
    "target_id": {
      "$ref": "#/$defs/identifier"
    },
    "config_digest": {
      "$ref": "#/$defs/digest"
    },
    "world_digest": {
      "$ref": "#/$defs/digest"
    },
    "repositories": {
      "type": "array",
      "minItems": 1,
      "items": {
        "type": "object",
        "additionalProperties": false,
        "required": [
          "name",
          "revision",
          "tree_digest"
        ],
        "properties": {
          "name": {
            "$ref": "#/$defs/name"
          },
          "revision": {
            "$ref": "#/$defs/revision"
          },
          "tree_digest": {
            "$ref": "#/$defs/digest"
          }
        }
      }
    },
    "profile": {
      "type": "object",
      "additionalProperties": false,
      "required": [
        "id",
        "revision"
      ],
      "properties": {
        "id": {
          "$ref": "#/$defs/identifier"
        },
        "revision": {
          "$ref": "#/$defs/revision"
        }
      }
    },
    "toolchain": {
      "type": "object",
      "additionalProperties": false,
      "required": [
        "portage_version",
        "digest"
      ],
      "properties": {
        "portage_version": {
          "type": "string",
          "minLength": 1,
          "maxLength": 128,
          "pattern": "^[A-Za-z0-9][A-Za-z0-9._+~-]*$"
        },
        "digest": {
          "$ref": "#/$defs/digest"
        }
      }
    }
  },
  "$defs": {
    "digest": {
      "type": "string",
      "pattern": "^sha256:[0-9a-f]{64}$"
    },
    "revision": {
      "type": "string",
      "pattern": "^[0-9a-f]{40}([0-9a-f]{24})?$"
    },
    "name": {
      "type": "string",
      "minLength": 1,
      "maxLength": 64,
      "pattern": "^[a-z0-9][a-z0-9._+-]*$"
    },
    "identifier": {
      "type": "string",
      "minLength": 3,
      "maxLength": 192,
      "pattern": "^[a-z0-9][a-z0-9._+-]*(/[a-z0-9][a-z0-9._+-]*)+$"
    }
  }
}
