{"config_digest":"sha256:6666666666666666666666666666666666666666666666666666666666666666","profile":{"id":"volatoo/amd64/glibc/openrc/base-v1","revision":"1111111111111111111111111111111111111111"},"repositories":[{"name":"gentoo","revision":"2222222222222222222222222222222222222222","tree_digest":"sha256:2222222222222222222222222222222222222222222222222222222222222222"},{"name":"volatoo-overlay","revision":"3333333333333333333333333333333333333333","tree_digest":"sha256:3333333333333333333333333333333333333333333333333333333333333333"}],"schema":"org.volatoo.portage-state/v1","target_id":"volatoo/amd64/glibc/openrc/23.0/base-v1","toolchain":{"digest":"sha256:5555555555555555555555555555555555555555555555555555555555555555","portage_version":"3.0.77"},"world_digest":"sha256:cccccccccccccccccccccccccccccccccccccccccccccccccccccccccccccccc"}
